{
  "report_schema": "extraction-report-v1",
  "evaluator_version": "extraction-evaluator-v2",
  "evaluation_kind": "structural_fixture_replay",
  "quality_claim": "none_structural_replay_only",
  "run": {
    "run_id": "2026-10-25T12-07-39-544Z-development",
    "started_at": "2026-10-25T12:07:39.544Z",
    "split": "development",
    "provider": "cassette",
    "model_id": "development-gold-fixture-v0.1",
    "configured_model_id": "cassette-datascout-v1",
    "prompt_version": "extract-v5",
    "safety_check": "evaluation_allow_all",
    "extraction_schema": "ExtractedRequirements",
    "extraction_schema_version": "1",
    "corpus_sha256": "bd4c7101b0e9f44ba07c3fc5069daf6a12b8f186a4d8ff08d6405e7da652d12f",
    "case_count": 40,
    "cassette_directory": "C:\\Users\\Poorvaja\\Desktop\\datascout\\packages\\ai\\test\\fixtures\\corpus-cassettes-v3"
  },
  "metrics": {
    "cases": 40,
    "all_fields_exact_match_cases": 40,
    "all_fields_exact_match_rate": 1,
    "per_field": {
      "topic": {
        "exact_matches": 40,
        "cases": 40,
        "exact_match_rate": 1
      },
      "geography": {
        "exact_matches": 40,
        "cases": 40,
        "exact_match_rate": 1
      },
      "time_coverage": {
        "exact_matches": 40,
        "cases": 40,
        "exact_match_rate": 1
      },
      "minimum_records": {
        "exact_matches": 40,
        "cases": 40,
        "exact_match_rate": 1
      },
      "required_features": {
        "exact_matches": 40,
        "cases": 40,
        "exact_match_rate": 1
      },
      "target": {
        "exact_matches": 40,
        "cases": 40,
        "exact_match_rate": 1
      },
      "preferences": {
        "exact_matches": 40,
        "cases": 40,
        "exact_match_rate": 1
      },
      "constraints": {
        "exact_matches": 40,
        "cases": 40,
        "exact_match_rate": 1
      }
    }
  },
  "cases": [
    {
      "case_id": "REQE-001",
      "split": "development",
      "result_kind": "ok",
      "fields": {
        "topic": {
          "expected": "crop yield",
          "actual": "crop yield",
          "exact_match": true
        },
        "geography": {
          "expected": "Maharashtra",
          "actual": "Maharashtra",
          "exact_match": true
        },
        "time_coverage": {
          "expected": null,
          "actual": null,
          "exact_match": true
        },
        "minimum_records": {
          "expected": null,
          "actual": null,
          "exact_match": true
        },
        "required_features": {
          "expected": [
            "rainfall",
            "temperature"
          ],
          "actual": [
            "rainfall",
            "temperature"
          ],
          "exact_match": true
        },
        "target": {
          "expected": null,
          "actual": null,
          "exact_match": true
        },
        "preferences": {
          "expected": [],
          "actual": [],
          "exact_match": true
        },
        "constraints": {
          "expected": [],
          "actual": [],
          "exact_match": true
        }
      }
    },
    {
      "case_id": "REQE-002",
      "split": "development",
      "result_kind": "ok",
      "fields": {
        "topic": {
          "expected": "air quality",
          "actual": "air quality",
          "exact_match": true
        },
        "geography": {
          "expected": "Delhi",
          "actual": "Delhi",
          "exact_match": true
        },
        "time_coverage": {
          "expected": "2018-2023",
          "actual": "2018-2023",
          "exact_match": true
        },
        "minimum_records": {
          "expected": 10000,
          "actual": 10000,
          "exact_match": true
        },
        "required_features": {
          "expected": [
            "PM2.5",
            "NO2"
          ],
          "actual": [
            "PM2.5",
            "NO2"
          ],
          "exact_match": true
        },
        "target": {
          "expected": null,
          "actual": null,
          "exact_match": true
        },
        "preferences": {
          "expected": [],
          "actual": [],
          "exact_match": true
        },
        "constraints": {
          "expected": [],
          "actual": [],
          "exact_match": true
        }
      }
    },
    {
      "case_id": "REQE-003",
      "split": "development",
      "result_kind": "ok",
      "fields": {
        "topic": {
          "expected": "house prices",
          "actual": "house prices",
          "exact_match": true
        },
        "geography": {
          "expected": "Bengaluru",
          "actual": "Bengaluru",
          "exact_match": true
        },
        "time_coverage": {
          "expected": null,
          "actual": null,
          "exact_match": true
        },
        "minimum_records": {
          "expected": null,
          "actual": null,
          "exact_match": true
        },
        "required_features": {
          "expected": [
            "area",
            "bedrooms",
            "neighborhood"
          ],
          "actual": [
            "area",
            "bedrooms",
            "neighborhood"
          ],
          "exact_match": true
        },
        "target": {
          "expected": "house prices",
          "actual": "house prices",
          "exact_match": true
        },
        "preferences": {
          "expected": [],
          "actual": [],
          "exact_match": true
        },
        "constraints": {
          "expected": [],
          "actual": [],
          "exact_match": true
        }
      }
    },
    {
      "case_id": "REQE-004",
      "split": "development",
      "result_kind": "ok",
      "fields": {
        "topic": {
          "expected": "public health survey",
          "actual": "public health survey",
          "exact_match": true
        },
        "geography": {
          "expected": "Kenya",
          "actual": "Kenya",
          "exact_match": true
        },
        "time_coverage": {
          "expected": "2015-2020",
          "actual": "2015-2020",
          "exact_match": true
        },
        "minimum_records": {
          "expected": 5000,
          "actual": 5000,
          "exact_match": true
        },
        "required_features": {
          "expected": [],
          "actual": [],
          "exact_match": true
        },
        "target": {
          "expected": null,
          "actual": null,
          "exact_match": true
        },
        "preferences": {
          "expected": [],
          "actual": [],
          "exact_match": true
        },
        "constraints": {
          "expected": [],
          "actual": [],
          "exact_match": true
        }
      }
    },
    {
      "case_id": "REQE-005",
      "split": "development",
      "result_kind": "ok",
      "fields": {
        "topic": {
          "expected": "handwritten digit recognition",
          "actual": "handwritten digit recognition",
          "exact_match": true
        },
        "geography": {
          "expected": null,
          "actual": null,
          "exact_match": true
        },
        "time_coverage": {
          "expected": null,
          "actual": null,
          "exact_match": true
        },
        "minimum_records": {
          "expected": null,
          "actual": null,
          "exact_match": true
        },
        "required_features": {
          "expected": [],
          "actual": [],
          "exact_match": true
        },
        "target": {
          "expected": null,
          "actual": null,
          "exact_match": true
        },
        "preferences": {
          "expected": [],
          "actual": [],
          "exact_match": true
        },
        "constraints": {
          "expected": [
            "OpenML"
          ],
          "actual": [
            "OpenML"
          ],
          "exact_match": true
        }
      }
    },
    {
      "case_id": "REQE-006",
      "split": "development",
      "result_kind": "ok",
      "fields": {
        "topic": {
          "expected": "sentiment analysis",
          "actual": "sentiment analysis",
          "exact_match": true
        },
        "geography": {
          "expected": null,
          "actual": null,
          "exact_match": true
        },
        "time_coverage": {
          "expected": null,
          "actual": null,
          "exact_match": true
        },
        "minimum_records": {
          "expected": null,
          "actual": null,
          "exact_match": true
        },
        "required_features": {
          "expected": [
            "text"
          ],
          "actual": [
            "text"
          ],
          "exact_match": true
        },
        "target": {
          "expected": "sentiment label",
          "actual": "sentiment label",
          "exact_match": true
        },
        "preferences": {
          "expected": [],
          "actual": [],
          "exact_match": true
        },
        "constraints": {
          "expected": [
            "Hugging Face Datasets"
          ],
          "actual": [
            "Hugging Face Datasets"
          ],
          "exact_match": true
        }
      }
    },
    {
      "case_id": "REQE-007",
      "split": "development",
      "result_kind": "ok",
      "fields": {
        "topic": {
          "expected": "GDP per capita",
          "actual": "GDP per capita",
          "exact_match": true
        },
        "geography": {
          "expected": "Nepal",
          "actual": "Nepal",
          "exact_match": true
        },
        "time_coverage": {
          "expected": "2000-2022",
          "actual": "2000-2022",
          "exact_match": true
        },
        "minimum_records": {
          "expected": null,
          "actual": null,
          "exact_match": true
        },
        "required_features": {
          "expected": [],
          "actual": [],
          "exact_match": true
        },